{
  "$schema": "https://json-schema.org/draft/2020-12/schema",
  "$id": "https://example.invalid/ditto-ai-chaos/schemas/finding.schema.json",
  "title": "Evidence-backed resilience finding",
  "type": "object",
  "additionalProperties": false,
  "required": ["schema_version", "id", "run_id", "severity", "summary", "evidence", "recommendation", "confidence"],
  "properties": {
    "schema_version": { "const": "1.0" },
    "id": { "type": "string", "minLength": 1 },
    "run_id": { "type": "string", "minLength": 1 },
    "severity": { "enum": ["info", "low", "medium", "high", "critical"] },
    "summary": { "type": "string", "minLength": 1 },
    "evidence": { "type": "array", "minItems": 1, "items": { "type": "string", "minLength": 1 } },
    "recommendation": { "type": "string", "minLength": 1 },
    "confidence": { "type": "number", "minimum": 0, "maximum": 1 },
    "ai_generated": { "type": "boolean" }
  }
}